{"name":"TECHSPO Singapore 2019","series":"","short":"","website":"https://techsposingapore.sg","content":"Where Business, Tech and Innovation Collide in Singapore! TECHSPO Singapore 2019 is a two-day technology expo taking place September 18th to 19th, 2019 at the luxurious Marina Bay Sands Expo and Convention Centre in Singapore. TECHSPO Singapore brings together some of the best developers, brands, marketers, technology providers, designers, innovators and evangelists looking to set the pace in our advanced world of technology. Watch exhibitors showcase the next generation of advances in technology & innovation, including; Internet, Mobile, AdTech, MarTech and SaaS technologies. Be prepared to be inspired, amazed and educated on how these evolving technologies will impact your business for greater growth. As part of TECHSPO Singapore is a limited attendance event, DigiMarCon Asia Pacific 2019 Digital Marketing Conference (https://digimarconapac.com). If the conference is where the learning, theory and inspiration happens, then the TECHSPO floor is where the testing, networking and product interaction takes place. The TECHSPO floor is free to attend if you register TODAY (for a limited time)! For more details, visit https://techsposingapore.sg.","date_start":"2019-09-18","date_end":"2019-09-19","important_dates":{"abstract":"","full":"2019-09-18","notification":"","final":""},"topics":["Business","Marketing/Social-Networking"],"location":{"virtual":"","full":["Singapore","Singapore"],"name":"","street":"","city":"Singapore","state":"","ZIP":"","country":"Singapore"},"organizers":["TECHSPO Singapore"],"societies":[],"indexes":[],"emails":[]}