{"name":"The 6th Int'l Conference on Semiconductor Physics and Devices","series":"","short":"ICSPD 2021","website":"https://www.deconf.org/conference/ICSPD2021","content":"The 6th Int'l Conference on Semiconductor Physics and Devices (ICSPD 2021) Conference Date: December 4-6, 2021 Conference Venue: Sanya, China Website: https://www.deconf.org/conference/ICSPD2021/ Online Registration: https://www.deconf.org/RegistrationSubmission/default.aspx?ConferenceID=1418 Email Registration: workshop12@163.com The 6th Int'l Conference on Semiconductor Physics and Devices (ICSPD 2021) will be held during December 4-6, 2021 in Sanya, China. This Conference will cover issues on Compound Semiconductors, Emerging Semiconductor Technologies, Ferromagnetism / Magnetic Semiconductors, Organic Semiconductors, Photoelectric and Photovoltaic Devices, Physics of Semiconductors and other related topics. It dedicates to creating a stage for exchanging the latest research results and sharing the advanced research methods. If you wish to serve the conference as an invited speaker, please send email to us with your CV. We'll contact with you asap. Publication and Presentation Publication: All the accepted papers will be published by a peer-reviewed open access journal that can ensure the widest dissemination of your published work, for more information, please contact us (workshop12@163.com) Index: CNKI and Google Scholar Note: If you want to present your research results but do NOT wish to publish a paper, you may simply submit an Abstract to our Registration System. Contact Us Email: workshop12@163.com Tel: +86 18672346485 QQ: 1349406763 WeChat: 3025797047 Twitter: conf\\_Committee Attendance Methods 1\\. Submit full paper (Regular Attendance+Paper Publication+Presentation) You are welcome to submit full paper, all the accepted papers will be published by Open access journal. 2\\. Submit abstract (Regular Attendance+Abstract+Presentation) 3\\. Regular Attendance (No Submission Required) Conference Topics Complex Oxides Compound Semiconductors Device Design and Fabrication Device Performance and Reliability Emerging Semiconductor Technologies Ferromagnetism / Magnetic Semiconductors High Magnetic Fields / High Pressure in Semiconductor Physics Impurities/Defects in Semiconductors Light Emitting Diodes (LEDs) and Diode Lasers Novel Semiconductor Devices and Applications Organic Semiconductors Photoelectric and Photovoltaic Devices Physics of Semiconductors Photophysics & Transient Absorption Spectroscopy/Measurements Surface and Interface Physics Semiconductor Lower Dimensions and Nanostructures Semiconductor Quantum Dots / Quantum Hall Effects / Quantum Information Semiconductor Materials and Applications / Semiconductor Processing Semiconductor Spintronics / Topological Insulators Semiconductor Detectors Wide/narrow Band-gap Semiconductors Other Related Topics","date_start":"2021-12-04","date_end":"2021-12-06","important_dates":{"abstract":"","full":"2021-11-01","notification":"","final":""},"topics":["Physical Science & Math","Physics"],"location":{"virtual":"","full":["Sanya","China"],"name":"","street":"","city":"Sanya","state":"","ZIP":"","country":"China"},"organizers":[""],"societies":[],"indexes":[],"emails":["workshop12@163.com"]}