{"name":"The 5th Int'l Environmental Economics Conference","series":"","short":"EEC 2022","website":"https://scet-meeting.org/conference/EEC2022","content":"The 5th Int'l Environmental Economics Conference (EEC 2022) Conference Date: April 22-24, 2022 Conference Venue: Suzhou, China Website: https://scet-meeting.org/conference/EEC2022/ Online Registration: https://www.scetmeeting.org/RegistrationSubmission/default.aspx?ConferenceID=1451 Email Registration: paper\\_service@163.com The 5th Int'l Environmental Economics Conference (EEC 2022) will be held during April 22-24, 2022 in Suzhou, China. This Conference will cover issues on Environmental Economics, and other related topics. It dedicates to creating a stage for exchanging the latest research results and sharing the advanced research methods in related fields. If you wish to serve the conference as an invited speaker, please send email to us with your CV. We'll contact with you asap. Publication and Presentation Publication: Open Access Journal, please contact us for detailed information Index: CNKI and Google Scholar Note: If you want to present your research results but do NOT wish to publish a paper, you may simply submit an Abstract to our Registration System. Contact Us Email: paper\\_service@163.com Tel: +86 18627814037 QQ: 1349406763 WeChat: 3025797047 Official Account: Academic Communications Twitter: conf\\_Committee Attendance Methods 1\\. Submit full paper (Regular Attendance+Paper Publication+Presentation) You are welcome to submit full paper, all the accepted papers will be published by Open access journal. 2\\. Submit abstract (Regular Attendance+Abstract+Presentation) 3\\. Regular Attendance (No Submission Required) Conference Topics Environmental Policies, Planning and Management Ecosystem Services and Management Economic Instruments for Water, Manufacturing and Energy Sectors Market Failure Including Externalities, Non-excludability and Non-rivalry Cost-benefit and Cost-effectiveness Analyses Modeling and Simulation Institutional Arrangements Resource Pricing / Economic Valuation of Environmental Goods Indicators of Environmental Quality Environmental Econometrics and Methodological Issues Environmental Performance Decision-making in Environmental Protection Climate Change Economics / Climate Policy Sustainable Development Green Economics Environmental economics Natural resources and environmental issues Analysis of environmental policy Further development of valuation techniques and novel applications Environmental behavior and responses to regulation Analyses of exhaustible, renewable and non-renewable resources and resource policy Analyses of the carbon cycle, accumulating pollutants, such as greenhouse gases Environmental problems in developing countries Degradation of natural resources and health problems caused by pollution Topics of energy economics related to the environment Topics of agricultural economics related to the environment Other Related Topics","date_start":"2022-04-22","date_end":"2022-04-24","important_dates":{"abstract":"","full":"2022-04-22","notification":"","final":""},"topics":["Engineering & Technology","Architectural/Environmental"],"location":{"virtual":"","full":["Suzhou","China"],"name":"","street":"","city":"Suzhou","state":"","ZIP":"","country":"China"},"organizers":[""],"societies":[],"indexes":[],"emails":["_service@163.com"]}