{"name":"The 4th Conference on Accounting and Financial Management","series":"","short":"AFM 2019","website":"http://www.marchconf.org/conference/AFM2019","content":"The 4th Conference on Accounting and Financial Management (AFM 2019) Conference：March 23 - 25, 2019 Venue：Xi'an, China Website：http://www.marchconf.org/conference/AFM2019/ Online Registration Entrance：http://www.marchconf.org/RegistrationSubmission/default.aspx?ConferenceID=1084 The 4th Conference on Accounting and Financial Management (AFM 2019) will be held from March 23 to 25, 2019 in Xi'an, China. The aim of AFM 2019 is to provide a stage for researchers, engineers, academicians as well as industrial professionals from all over the world to present their latest research results and advanced research methods. Attendance Methods 1\\. Submit full paper. All the accepted papers will be published by a peer-reviewed open access journal \"Open Journal of Social Sciences\". 2\\. You are welcome to submit abstract for oral presentation or poster presentation. 3\\. You're also welcome to attend our conference (without submitting full paper or abstract) Contact Us Email: Rolinrolin@126.com Tel: +86 - 15527426990 QQ: 3025797047","date_start":"2019-03-23","date_end":"2019-03-25","important_dates":{"abstract":"","full":"2019-03-23","notification":"","final":""},"topics":["Business","Accounting"],"location":{"virtual":"","full":["Xi'an","China"],"name":"","street":"","city":"Xi'an","state":"","ZIP":"","country":"China"},"organizers":["Engineering Information Institute"],"societies":[],"indexes":[],"emails":["rolinrolin@126.com"]}