{"name":"TECHSPO Sydney 2019","series":"","short":"","website":"https://techsposydney.com","content":"Where Business, Tech and Innovation Collide in Sydney! TECHSPO Sydney 2019 is a two-day technology expo taking place August 28th to 29th, 2019 at the ANZ Stadium in Sydney, Australia. TECHSPO Sydney brings together some of the best developers, brands, marketers, technology providers, designers, innovators and evangelists looking to set the pace in our advanced world of technology. Watch exhibitors showcase the next generation of advances in technology & innovation, including; Internet, Mobile, AdTech, MarTech and SaaS technologies. Be prepared to be inspired, amazed and educated on how these evolving technologies will impact your business for greater growth. As part of TECHSPO Sydney is a limited attendance event, DigiMarCon Australia 2019 Digital Marketing Conference (https://digimarconaustralia.com). If the conference is where the learning, theory and inspiration happens, then the TECHSPO floor is where the testing, networking and product interaction takes place. The TECHSPO floor is free to attend if you register TODAY (for a limited time)! For more details, visit https://techsposydney.com.","date_start":"2019-08-28","date_end":"2019-08-29","important_dates":{"abstract":"","full":"","notification":"","final":""},"topics":["Business","Marketing/Social-Networking"],"location":{"virtual":"","full":["Sydney","Australia"],"name":"","street":"","city":"Sydney","state":"","ZIP":"","country":"Australia"},"organizers":[""],"societies":[],"indexes":[],"emails":[]}