{"name":"International Conference on Computing and Information Technology Trends","series":"","short":"CCITT 2022","website":"https://ccitt2022.org/index","content":"International Conference on Computing and Information Technology Trends (CCITT 2022) March 12\\~13, 2022, Virtual Conference https://ccitt2022.org/index Scope International Conference on Computing and Information Technology Trends (CCITT 2022) will provide an excellent international forum for sharing knowledge and results in theory, methodology and applications of Computing and Information Technology Trends. The Conference looks for significant contributions to all major fields of the Computer Science, Compute Engineering, Information Technology and Trends in theoretical and practical aspects. Authors are solicited to contribute to the conference by submitting articles that illustrate research results, projects, surveying works and industrial experiences that describe significant advances in the following areas, but are not limited to. Topics of interest include, but are not limited to, the following • Artificial Intelligence • Big Data • Bioinformatics and Algorithms • Blockchain • Business Intelligence • Computer Architecture and Real Time Systems • Computer Education • Data Science • Database and Data Mining • Deep Learning • Dependable, Reliable and Autonomic Computing • Devops Models, Practices, Challenges • Distributed and Parallel Systems • DSP/Image Processing/Pattern Recognition/Multimedia • E-Learning, E-Business, Enterprise Information Systems and E-Government • Embedded System and Software • Fuzzy Systems • Game and Software Engineering • Grid and Scalable Computing • Information Technology Management • Intelligent Information and Database Systems • Internet of Things • Knowledge Management • Machine Learning & Applications • Mobile and Ubiquitous Computing • Modeling and Simulation • Multimedia Systems and Services • Natural Language Processing & Text Mining • Networking and Communications • Ontology and Semantic Web • Performance Evaluation • Security and Information Assurance • Scaled Agile Framework (SAFe) in the real World • Smart cities • Software Automation, Software as a Service ( Saas) • Software Engineering • Swarm Intelligence • Theoretical Computer Science • Web and Internet Computing Paper Submission Authors are invited to submit papers through the conference Submission System by February 19, 2022\\. Submissions must be original and should not have been published previously or be under consideration for publication while being evaluated for this conference. The proceedings of the conference will be published by International Journal on Cybernetics & Informatics ( IJCI) (Confirmed). Selected papers from CCITT 2022, after further revisions, will be published in the special issue of the following journal. • International Journal on Computational Science & Applications (IJCSA) • International Journal on Bioinformatics & Biosciences (IJBB) • International Journal On Cryptography And Information Security (IJCIS) • International Journal of Fuzzy Logic Systems (IJFLS) • International Journal of Mobile Network Communications & Telematics (IJMNCT) • International Journal of Programming Languages and Applications (IJPLA) • International Journal of Embedded Systems and Applications (IJESA) Important Dates • Submission Deadline: February 19, 2022\\. • Authors Notification: March 05, 2022 • Registration & camera - Ready Paper Due : March 08, 2022 Contact Us Here's where you can reach us : ccitt@ccitt2022.org (or) ccittconf@yahoo.com","date_start":"2022-03-12","date_end":"2022-03-13","important_dates":{"abstract":"","full":"2022-02-19","notification":"","final":""},"topics":["Business","Information-Technology","Information Security"],"location":{"virtual":"","full":["Online Event",""],"name":"","street":"","city":"Online Event","state":"","ZIP":"","country":""},"organizers":["CCITT"],"societies":[],"indexes":[],"emails":["ccitt@ccitt2022.org","ccittconf@yahoo.com"]}