{"name":"CFP (Extended Deadline): BROLLY. Journal of Social Sciences","series":"","short":"","website":"www.journals.lapub.co.uk/index.php/Brolly","content":"CFP (Extended Deadline): BROLLY. Journal of Social Sciences Vol. 3, No. 3 (December 2020) London Academic Publishing, UK Ext. Submission Deadline: December 10, 2020 No publication fee will be charged. Published in Open Access ISSN 2516-869X (Print) ISSN 2516-8703 (Online) Contact: brolly@journals.lapub.co.uk Web: www.journals.lapub.co.uk/index.php/Brolly; lapub.co.uk BROLLY welcomes submissions of original papers that make contributions to the research field of social sciences, pursuing the changes that occur in the contemporary world. The journal publishes each issue a selection of articles in the areas of philosophy, sociology, political sciences, ethics, education, semiotics, psychology, communication, economic and cultural studies.","date_start":"2020-12-10","date_end":"","important_dates":{"abstract":"","full":"2020-12-10","notification":"","final":""},"topics":["Social Sciences","Other","Sociology, Social Sciences"],"location":{"virtual":"","full":["London","United Kingdom"],"name":"","street":"","city":"London","state":"","ZIP":"","country":"United Kingdom"},"organizers":["London Academic Publishing"],"societies":[],"indexes":[],"emails":["brolly@journals.lapub.co.uk"]}