{"name":"Advanced Energy: An International Journal","series":"","short":"AEIJ","website":"http://airccse.com/aeij/index.html","content":"Advanced Energy: An International Journal (AEIJ) ISSN : 2349 - 6231 http://airccse.com/aeij/index.html Call for Papers: Advanced Energy: An International Journal (AEIJ) is a quarterly open access peer-reviewed journal that publishes articles which contribute new results in all areas of the Energy Engineering and allied fields. This multi disciplinary journal is devoted to the publication of high quality papers on theoretical and practical aspects of Energy Engineering. Authors are solicited to contribute to the journal by submitting articles that illustrate research results, projects, surveying works and industrial experiences that describe significant advances in all areas of Energy Engineering. Topics of Interest include, but are not limited to, the following • Advanced conversion technology • Biomass conversion technology • Commodities , Energy Mix and Environmental Engineering • Climate change mitigation • Data Analysis • Electrical Grids • E-mobility • Energy Management • Energy Storage • Energy sustainability • Environment and sustainability • Experimental Support • Green Buildings • Investments and Production Costs • Materials and Structural Analyses • Mathematical Modeling and Computer Simulations • Nano-micro energy systems • Power Plant Technologies and Engineering • Regulations, Legislations, Collaboration • Renewable (Green) Energy Systems and Sources (RESSs) • Small hydropower system • Solar thermal technologies • System Safety and Cyber Security Paper Submission Authors are invited to submit papers for this journal through Submission System. Submissions must be original and should not have been published previously or be under consideration for publication while being evaluated for this Journal. For paper format download the template in this page Important Dates • Submission Deadline : January 07, 2023 • Notification : January 25, 2023 • Final Manuscript Due : January 28, 2023 • Publication Date: Determined by the Editor-in-Chief Contact Us: Here's where you can reach us : aeijjournal@yahoo.com or aeijjournal@airccse.com Submission URL: http://airccse.com/submission/home.html","date_start":"2023-02-07","date_end":"","important_dates":{"abstract":"","full":"","notification":"","final":""},"topics":["Engineering & Technology","Renewable Energy/Nuclear","Energy Storage"],"location":{"virtual":"","full":["Online Event",""],"name":"","street":"","city":"Online Event","state":"","ZIP":"","country":""},"organizers":[""],"societies":[],"indexes":[],"emails":["aeijjournal@yahoo.com","aeijjournal@airccse.com"]}