{"name":"9th International Conference on Artificial Intelligence and Fuzzy Logic Systems","series":"","short":"AIFZ 2023","website":"https://csity2023.org/aifz/index","content":"9th International Conference on Artificial Intelligence and Fuzzy Logic Systems (AIFZ 2023) September 16 \\~ 17, 2023, Copenhagen, Denmark https://csity2023.org/aifz/index Call for Papers 9th International Conference on Artificial Intelligence and Fuzzy Logic Systems (AIFZ 2023) is a forum for presenting new advances and research results in the fields of Artificial Intelligence and Fuzzy Logic Systems. The conference will bring together leading researchers, engineers, and scientists in the domain of interest from around the world. The scope of the conference covers all theoretical and practical aspects of the Artificial Intelligence and Fuzzy Logic Systems. Authors are solicited to contribute to the conference by submitting articles that illustrate research results, projects, surveying works and industrial experiences. All submissions must describe original research, not published or currently under review for another conference or journal. Topics of interest include but are not limited to the following. Topics of interest include, but are not limited to, the following: • AI Algorithms • Artificial Intelligence • Artificial Intelligence Tools & Applications • Automatic Control • Bioinformatics • CAD Design & Testing • Computational Theories of Learning • Computer Vision and Speech Understanding • Data Mining and Machine Learning Tools • Fuzzy Clustering • Fuzzy Database • Fuzzy Decision Making and Decision Support Systems • Fuzzy Decision Support System • Fuzzy Expert System • Fuzzy Logic • Fuzzy Logic Systems • Fuzzy logic Techniques & Algorithm • Fuzzy Mathematical Programming • Fuzzy Mathematics • Fuzzy Measure and Integral • Fuzzy Modeling and Fuzzy Control of Biotechnological Processes • Fuzzy Neural Systems, Neuro-Fuzzy Systems • Fuzzy Pattern Recognition • Fuzzy Process Control • Fuzzy Reasoning System • Fuzzy Sets in Bioinformatics • Fuzzy System Applications in Computer Vision • Fuzzy System Applications in E-commerce • Fuzzy System Applications in Human-Machine Interface • Fuzzy System Applications in Robotics • Fuzzy System Applications in System and Control Engineering • Fuzzy System in Multimedia and Web-based Applications • Fuzzy Systems Modeling and Identification • Fuzzy-Rule based System • Heuristic and AI Planning Strategies and Tools • Hybrid Fuzzy Systems (fuzzy-neuro-evolutionary-rough) • Hybrid Intelligent Systems • Information Retrieval • Intelligent System Architectures • Knowledge Representation • Knowledge-based Systems • Mechatronics • Multimedia & Cognitive Informatics • Natural Language Processing • Neural Networks • Parallel Processing • Pattern Recognition • Pervasive Computing and Ambient Intelligence • Possibility Theory and Imprecise Probability • Programming Languages • Reasoning and Evolution • Recent Trends and Developments • Robotics • Semantic Web Techniques and Technologies • Soft Computing Theory and Applications • Software and Hardware Architectures • Type 2 Fuzzy Logic • Web Intelligence Applications and Search Paper Submission Authors are invited to submit papers through the conference Submission System by April 22, 2023\\. Submissions must be original and should not have been published previously or be under consideration for publication while being evaluated for this conference. The proceedings of the conference will be published by Computer Science Conference Proceedings in Computer Science & Information Technology (CS & IT) series (Confirmed). Selected papers from AIFZ 2023, after further revisions, will be published in the special issue of the following journal. • International Journal of Artificial Intelligence & Applications (IJAIA) • International Journal of Network Security & Its Applications (IJNSA) – ERA, WJCI Indexed • International Journal of Fuzzy Logic Systems (IJFLS) • Information Technology in Industry (ITII) Important Dates • Submission Deadline : April 22, 2023 • Notification : June 30, 2023 • Final Manuscript Due : July 08, 2023 • Publication Date : Determined by the Editor-in-Chief Contact Us Here's where you can reach us: aifz@csity2023.org or aifz\\_conf@yahoo.com Submission Link: https://csity2023.org/submission/index.php","date_start":"2023-09-16","date_end":"2023-09-17","important_dates":{"abstract":"","full":"2023-04-22","notification":"","final":""},"topics":["Arts & Humanities","Other","AI Algorithms"],"location":{"virtual":"","full":["Denmark"],"name":"","street":"","city":"","state":"","ZIP":"","country":""},"organizers":[""],"societies":[],"indexes":[],"emails":["aifz@csity2023.org","_conf@yahoo.com"]}