{"name":"5th Edition of International Conference on Dermatology and Cosmetology","series":"","short":"","website":"https://dermatology-conferences.com/ ","content":"Magnus Group is thrilled to invite one and all to its highly established event solely dedicated to dermatology and cosmetology, “5th Edition of International Conference on Dermatology and Cosmetology” (IDC 2024) which is all set to take place in Paris, France and virtually during June 24-26, 2024\\. IDC 2024 promises to be an enlightening experience, bringing together professionals, experts, researchers, and enthusiasts from around the world. Dermatology Conferences will revolve around the theme of \"Revolutionizing Skin Care Through Advances in Dermatology & Cosmetology\" highlighting the latest breakthroughs and innovations in the field. With a comprehensive program, IDC 2024 Dermatology Congress will offer a platform for knowledge exchange, networking, and collaboration among individuals involved in dermatology and cosmetology. From cutting-edge research to practical applications, the Dermatology Conference will provide valuable insights into the ever-evolving field of dermatology and cosmetology. In addition to the in-person Cosmetology Conferences in Paris, virtual participation options will be available, allowing attendees to join from anywhere in the world. Cosmetology Conference ensures that the knowledge-sharing and networking opportunities are accessible to a diverse global audience. We invite all professionals, researchers, clinicians, industry representatives, and anyone passionate about dermatology and cosmetology to join us at IDC 2024\\. We look forward to your participation in IDC 2024, where together, we can revolutionize skin care through advancements in dermatology and cosmetology. Dermatology Conferences 2024 | Cosmetology Conference 2024 | Dermatology Conferences | Dermatology Conference | IDC 2024 | World Cosmetology Conference | Dermatology and Cosmetology Conferences 2024 | IDC Events | Cosmetology Congress | World Dermatology and Cosmetology Congress | Dermatology Meetings | Leading Dermatology Events | 2024 Cosmetology Event | Dermatology and Cosmetology Events in France | Cosmetology summits in France | 2024 Dermatology events | Cosmetology Events in June| Dermatology Summit | Dermatology and Cosmetology Conference 2024 | Dermatology Conference and Technology | Cosmetology Meetings | Dermatology Webinar | Dermatology Workshop | International Dermatology and Cosmetology meet | Science Conference | Dermatology | Science | World IDC conference 2024 | Science Conference 2024 | Dermatology Conference France| Upcoming Cosmetic Dermatology Events | Upcoming World Dermatology and Cosmetology Conferences. Reach us at: Contact Email: dermatology@magnusconference.com Phone: +1 702 988-2320 WhatsApp: +1 434 264 7183 Dates: June 24-26, 2024 Venue: Paris, France Website: https://dermatology-conferences.com/ Abstract submission: https://dermatology-conferences.com/submit-abstract Registration: https://dermatology-conferences.com/register Social Media Link: Facebook: https://www.facebook.com/dermaconferences/ Twitter: https://twitter.com/dermatologycong","date_start":"2024-06-24","date_end":"2024-06-26","important_dates":{"abstract":"","full":"2024-06-24","notification":"","final":""},"topics":["Medicine & Health","Other"],"location":{"virtual":"","full":["paris","France"],"name":"","street":"","city":"paris","state":"","ZIP":"","country":"France"},"organizers":["Magnus group"],"societies":[],"indexes":[],"emails":["dermatology@magnusconference.com"]}