{"name":"3rd International Conference on Education and Technology","series":"","short":"EDUTEC 2024","website":"https://edutec2024.org","content":"3rd International Conference on Education and Technology (EDUTEC 2024) January 13-14, 2024, Virtual Conference https://edutec2024.org/ Scope & Topics 3rd International Conference on Education and Technology (EDUTEC 2024) will act as a major forum for the presentation of innovative ideas, approaches, developments, and research projects in the areas of Education. We hope EDUTEC outcome will lead to substantial contributions to the knowledge base which is up-to-date in scientific fields. It will provide an excellent international forum for sharing knowledge and results in theory, methodology and applications of Education. The Conference looks for significant contributions to all major fields of the Education and Technology in theoretical and practical aspects. Topics of interest include, but are not limited to, the following • Collaborative, Interactive Learning • Games and Simulations in Education • Global Issues in Education and Research • Innovative Educational Practices • Institutional management and performance • Integrating Technology in Curriculum: Challenges & Strategies • Learning / Teaching Methodologies and Assessment • Learning Science & Analysis • Mobile / Ubiquitous Computing in Education • Multimedia in Education • Pandemic-based Educational Research • Pedagogy Enhancement with E-Learning • Professional Development for Teachers in ICT • Research in Progress • Social theory • Special education • Student Selection Criteria in Interdisciplinary Studies • Teacher Evaluation • Technology Support for Pervasive Learning • Tools for 21st Century Learning • Virtual and Remote Laboratories • Vocational, Higher education • Web 2.0, Social Networking, Blogs and Wikis • Web-based Tools for Education Paper Submission Authors are invited to submit papers through the conference Submission System by January 06, 2024(Final Call). Submissions must be original and should not have been published previously or be under consideration for publication while being evaluated for this conference. The proceedings of the conference will be published by International Journal on Cybernetics & Informatics (IJCI) (Confirmed). Selected papers from EDUTEC 2024, after further revisions, will be published in the special issue of the following journal. • International Journal of Education (IJE) • International Journal on Integrating Technology in Education (IJITE) Important Dates • Submission Deadline : January 06, 2024(Final Call) • Authors Notification : January 10, 2024 • Registration & Camera-Ready Paper Due : January 12, 2024 Contact Us Here's where you can reach us : edutec@edutec2024.org or edutecconf@yahoo.com","date_start":"2024-01-13","date_end":"2024-01-14","important_dates":{"abstract":"","full":"2024-01-06","notification":"","final":""},"topics":["Education / Legal / Other","Education","Special Education","Higher Education"],"location":{"virtual":"","full":["sydney","Australia"],"name":"","street":"","city":"sydney","state":"","ZIP":"","country":"Australia"},"organizers":["3rd International Conference on Education and Technology (EDUTEC 2024)"],"societies":[],"indexes":[],"emails":["edutec@edutec2024.org","edutecconf@yahoo.com"]}